ART_ID;ART_IDArea;ART_IDCategoria;ART_IDStato;ART_Titolo;abstract;ART_Testo;ART_DataInizioPubblicazione;ART_DataFinePubblicazione;ART_DataPubblicazione;ART_DataPubblicazionex;ART_DataUltimaModifica;ART_IDUtente;ART_Inviata;ART_Link;ART_Commento;ART_RuoliDocumento;ART_Evidenza
1962;32;94;A;Referendum Costituzionale - 4 dicembre 2016;"<p><img alt="""" src=""/public/upload/image/Camisano/Notizie in evidenza/Referendum Costituzionale 12-2016.jpg"" align=""left"" border=""0"" width=""176"" vspace=""5"" hspace=""5"" height=""120"" /><font face=""Verdana"" size=""3"">Referendum Costituzionale - 4 dicembre 2016</font></p>  <p><a target=""_blank"" href=""/public/upload/file/Notizie in evidenza/2016/Reperendum 12.2016/Informativa Voto all'estero.pdf""><font face=""Verdana"" size=""3"">Informativa voto</font></a></p>  <p><font face=""Verdana"" size=""3""><a target=""_blank"" href=""/public/upload/file/Notizie in evidenza/2016/Reperendum 12.2016/mod_opzione_voto_referendum_cost_4_12_2016_r2.pdf"">Opzione per l'esercizio del voto per corrispondenza nella circoscrizione estero</a></font></p>  <p>&nbsp;</p>  <p><em><u>[23.11.2016]</u></em></p>  <p><a href=""/public/upload/file/Notizie in evidenza/2016/Reperendum 12.2016/Avviso agli elettori Referendum 4.12.2016.pdf"" target=""_blank""><font face=""Verdana"" size=""3"">Avviso agli elettori</font></a></p>  <p><font face=""Verdana"" size=""3""><a href=""/public/upload/file/Notizie in evidenza/2016/Reperendum 12.2016/Orari Apertura Uffici Referendum 4.12.2016.pdf"" target=""_blank"">Orari apertura uffici comunale il 04.12.2016</a></font></p>  <p>&nbsp;</p>  <p><font face=""Verdana"" size=""3""><a href=""/public/upload/file/Notizie in evidenza/Risultati.pdf"" target=""_blank""><img src=""/public/upload/image/Camisano/Notizie in evidenza/camisano-referendum.png"" alt="""" width=""400"" height=""187"" /></a></font></p>";"<p><img alt="""" src=""/public/upload/image/Camisano/Notizie in evidenza/Referendum Costituzionale 12-2016.jpg"" align=""left"" border=""0"" width=""176"" vspace=""5"" hspace=""5"" height=""120"" /><font face=""Verdana"" size=""3"">Referendum Costituzionale - 4 dicembre 2016</font></p>  <p><a target=""_blank"" href=""/public/upload/file/Notizie in evidenza/2016/Reperendum 12.2016/Informativa Voto all'estero.pdf""><font face=""Verdana"" size=""3"">Informativa voto</font></a></p>  <p><font face=""Verdana"" size=""3""><a target=""_blank"" href=""/public/upload/file/Notizie in evidenza/2016/Reperendum 12.2016/mod_opzione_voto_referendum_cost_4_12_2016_r2.pdf"">Opzione per l'esercizio del voto per corrispondenza nella circoscrizione estero</a></font></p>  <p>&nbsp;</p>  <p><em><u>[23.11.2016]</u></em></p>  <p><a href=""/public/upload/file/Notizie in evidenza/2016/Reperendum 12.2016/Avviso agli elettori Referendum 4.12.2016.pdf"" target=""_blank""><font face=""Verdana"" size=""3"">Avviso agli elettori</font></a></p>  <p><font face=""Verdana"" size=""3""><a href=""/public/upload/file/Notizie in evidenza/2016/Reperendum 12.2016/Orari Apertura Uffici Referendum 4.12.2016.pdf"" target=""_blank"">Orari apertura uffici comunale il 04.12.2016</a></font></p>  <hr />  <p><font face=""Verdana"" size=""3""><a href=""/public/upload/file/Notizie in evidenza/Risultati.pdf"" target=""_blank""><img src=""/public/upload/image/Camisano/Notizie in evidenza/camisano-referendum.png"" alt="""" width=""400"" height=""187"" /></a></font></p>";2016-09-30 00:00:00.000;2026-09-30 23:59:59.000;2016-09-30 14:16:44.000;2016-09-30 00:00:00.000;2017-06-01 09:52:28.000;661;N;;NULL;NULL;NULL
1960;32;94;A;Dote Sport 2016;"<p><img alt="""" src=""/public/upload/image/Camisano/Notizie in evidenza/dotesport2016.png"" width=""150"" vspace=""5"" hspace=""5"" height=""219"" border=""0"" align=""left"" /><br />  <font size=""3"">Dote Sport 2016 </font></p>  <p><font size=""3"" face=""Verdana""><span style=""font-size: 14px; font-style: normal; font-variant-ligatures: normal; font-variant-caps: normal; font-weight: normal; letter-spacing: normal; line-height: 20px; text-align: start; text-indent: 0px; text-transform: none; white-space: normal; word-spacing: 0px; display: inline ! important; float: none; background-color: rgb(255, 255, 255);"">Per info dote sport:<span class=""Apple-converted-space"">&nbsp;</span></span><a href=""http://www.sport.regione.lombardia.it/"" rel=""nofollow noreferrer"" target=""_blank"" style=""text-decoration: none; margin: 0px; padding: 0px; font-size: 14px; vertical-align: baseline; cursor: pointer; font-style: normal; font-variant-ligatures: normal; font-variant-caps: normal; font-weight: normal; letter-spacing: normal; line-height: 20px; text-align: start; text-indent: 0px; text-transform: none; white-space: normal; word-spacing: 0px; background: rgb(255, 255, 255) none repeat scroll 0% 0%;"">www.sport.regione.lombardia.it</a><span style=""font-size: 14px; font-style: normal; font-variant-ligatures: normal; font-variant-caps: normal; font-weight: normal; letter-spacing: normal; line-height: 20px; text-align: start; text-indent: 0px; text-transform: none; white-space: normal; word-spacing: 0px; display: inline ! important; float: none; background-color: rgb(255, 255, 255);""><span class=""Apple-converted-space"">&nbsp;</span>oppure Ufficio Servizio Sociale</span></font></p>  <p><font size=""3"" face=""Verdana""><span style=""font-size: 14px; font-style: normal; font-variant-ligatures: normal; font-variant-caps: normal; font-weight: normal; letter-spacing: normal; line-height: 20px; text-align: start; text-indent: 0px; text-transform: none; white-space: normal; word-spacing: 0px; display: inline ! important; float: none; background-color: rgb(255, 255, 255);"">Scarica la brochure <a target=""_blank"" href=""/public/upload/file/Notizie in evidenza/2016/dote sport7/Brochure Dote Sport 2016.pdf""><img alt="""" src=""/KlanEditorTestuale/editor/images/smiley/msn/confused_smile.gif"" border=""0"" align=""absMiddle"" /></a></span></font></p>  <p><font size=""3"" face=""Verdana""><span style=""font-size: 14px; font-style: normal; font-variant-ligatures: normal; font-variant-caps: normal; font-weight: normal; letter-spacing: normal; line-height: 20px; text-align: start; text-indent: 0px; text-transform: none; white-space: normal; word-spacing: 0px; display: inline ! important; float: none; background-color: rgb(255, 255, 255);"">Scheda informativa </span></font><a target=""_blank"" href=""/public/upload/file/Notizie in evidenza/2016/dote sport7/Scheda informativa Bando Dote Sport 2016.pdf""><font size=""3"" face=""Verdana""><span style=""font-size: 14px; font-style: normal; font-variant-ligatures: normal; font-variant-caps: normal; font-weight: normal; letter-spacing: normal; line-height: 20px; text-align: start; text-indent: 0px; text-transform: none; white-space: normal; word-spacing: 0px; display: inline ! important; float: none; background-color: rgb(255, 255, 255);""><img alt="""" src=""/KlanEditorTestuale/editor/images/smiley/msn/confused_smile.gif"" border=""0"" align=""absMiddle"" /></span></font></a></p>";"<p><img alt="""" src=""/public/upload/image/Camisano/Notizie in evidenza/dotesport2016.png"" width=""150"" vspace=""5"" hspace=""5"" height=""219"" border=""0"" align=""left"" /><br />  <font size=""3"">Dote Sport 2016 </font></p>  <p><font size=""3"" face=""Verdana""><span style=""font-size: 14px; font-style: normal; font-variant-ligatures: normal; font-variant-caps: normal; font-weight: normal; letter-spacing: normal; line-height: 20px; text-align: start; text-indent: 0px; text-transform: none; white-space: normal; word-spacing: 0px; display: inline ! important; float: none; background-color: rgb(255, 255, 255);"">Per info dote sport:<span class=""Apple-converted-space"">&nbsp;</span></span><a href=""http://www.sport.regione.lombardia.it/"" rel=""nofollow noreferrer"" target=""_blank"" style=""text-decoration: none; margin: 0px; padding: 0px; font-size: 14px; vertical-align: baseline; cursor: pointer; font-style: normal; font-variant-ligatures: normal; font-variant-caps: normal; font-weight: normal; letter-spacing: normal; line-height: 20px; text-align: start; text-indent: 0px; text-transform: none; white-space: normal; word-spacing: 0px; background: rgb(255, 255, 255) none repeat scroll 0% 0%;"">www.sport.regione.lombardia.it</a><span style=""font-size: 14px; font-style: normal; font-variant-ligatures: normal; font-variant-caps: normal; font-weight: normal; letter-spacing: normal; line-height: 20px; text-align: start; text-indent: 0px; text-transform: none; white-space: normal; word-spacing: 0px; display: inline ! important; float: none; background-color: rgb(255, 255, 255);""><span class=""Apple-converted-space"">&nbsp;</span>oppure Ufficio Servizio Sociale</span></font></p>  <p><font size=""3"" face=""Verdana""><span style=""font-size: 14px; font-style: normal; font-variant-ligatures: normal; font-variant-caps: normal; font-weight: normal; letter-spacing: normal; line-height: 20px; text-align: start; text-indent: 0px; text-transform: none; white-space: normal; word-spacing: 0px; display: inline ! important; float: none; background-color: rgb(255, 255, 255);"">Scarica la brochure <a target=""_blank"" href=""/public/upload/file/Notizie in evidenza/2016/dote sport7/Brochure Dote Sport 2016.pdf""><img alt="""" src=""/KlanEditorTestuale/editor/images/smiley/msn/confused_smile.gif"" border=""0"" align=""absMiddle"" /></a></span></font></p>  <p><font size=""3"" face=""Verdana""><span style=""font-size: 14px; font-style: normal; font-variant-ligatures: normal; font-variant-caps: normal; font-weight: normal; letter-spacing: normal; line-height: 20px; text-align: start; text-indent: 0px; text-transform: none; white-space: normal; word-spacing: 0px; display: inline ! important; float: none; background-color: rgb(255, 255, 255);"">Scheda informativa </span></font><a target=""_blank"" href=""/public/upload/file/Notizie in evidenza/2016/dote sport7/Scheda informativa Bando Dote Sport 2016.pdf""><font size=""3"" face=""Verdana""><span style=""font-size: 14px; font-style: normal; font-variant-ligatures: normal; font-variant-caps: normal; font-weight: normal; letter-spacing: normal; line-height: 20px; text-align: start; text-indent: 0px; text-transform: none; white-space: normal; word-spacing: 0px; display: inline ! important; float: none; background-color: rgb(255, 255, 255);""><img alt="""" src=""/KlanEditorTestuale/editor/images/smiley/msn/confused_smile.gif"" border=""0"" align=""absMiddle"" /></span></font></a></p>";2016-09-14 00:00:00.000;2026-09-14 23:59:59.000;2016-09-14 10:03:42.000;2016-09-14 00:00:00.000;2017-02-15 14:46:15.000;661;N;;NULL;NULL;NULL
1959;32;94;A;"Carta acquisti SIA: sostegno per l&#39;inclusione attiva";"<p><img height=""125"" width=""201"" vspace=""5"" hspace=""5"" border=""0"" align=""left"" alt="""" src=""/public/upload/image/Camisano/Notizie in evidenza/CartaSIA.png"" /><font size=""3""><font face=""Verdana"">Carta Acquisti SIA: sostegno per l'inclusione attiva.</font></font></p>  <p><font size=""3""><font face=""Verdana"">Informativa SIA<a target=""_blank"" href=""/public/upload/file/Notizie in evidenza/2016/Informativa SIA.pdf""><img vspace=""2"" hspace=""2"" border=""0"" align=""absMiddle"" alt="""" src=""/KlanEditorTestuale/editor/images/smiley/msn/confused_smile.gif"" /></a></font></font></p>  <p><font size=""3""><font face=""Verdana"">Per informazioni rivolgersi all'Ufficio Servizio Sociale del Comune.</font></font></p>";"<p><img height=""125"" width=""201"" vspace=""5"" hspace=""5"" border=""0"" align=""left"" src=""/public/upload/image/Camisano/Notizie in evidenza/CartaSIA.png"" alt="""" /><font size=""3""><font face=""Verdana"">Carta Acquisti SIA: sostegno per l'inclusione attiva.</font></font></p>  <p><font size=""3""><font face=""Verdana"">Informativa SIA<a href=""/public/upload/file/Notizie in evidenza/2016/Informativa SIA.pdf"" target=""_blank""><img vspace=""2"" hspace=""2"" border=""0"" align=""absMiddle"" src=""/KlanEditorTestuale/editor/images/smiley/msn/confused_smile.gif"" alt="""" /></a></font></font></p>  <p><font size=""3""><font face=""Verdana"">Per informazioni rivolgersi all'Ufficio Servizio Sociale del Comune.</font></font></p>";2016-09-08 00:00:00.000;2026-09-08 23:59:59.000;2016-09-08 08:59:06.000;2016-09-08 00:00:00.000;2016-09-08 08:59:14.000;661;N;;NULL;NULL;S
1958;32;94;A;Emergenza Terremoto in centro Italia;"<p><img height=""157"" width=""400"" vspace=""5"" hspace=""5"" border=""0"" align=""absMiddle"" src=""/public/upload/image/Camisano/Notizie in evidenza/camisano-terremoto.png"" alt="""" /></p>  <p><font face=""Verdana"" size=""3"">Comunicato stampa - 26.08.2016 - <a href=""/public/upload/file/Notizie in evidenza/2016/26.08.2016 - Terremoto Centro Italia PC-CRI-CARITAS.pdf"" target=""_blank"">Scarica il documento</a></font></p>";"<p><img height=""157"" width=""400"" vspace=""5"" hspace=""5"" border=""0"" align=""absMiddle"" src=""/public/upload/image/Camisano/Notizie in evidenza/camisano-terremoto.png"" alt="""" /></p>  <p><font face=""Verdana"" size=""3"">Comunicato stampa - 26.08.2016 - <a href=""/public/upload/file/Notizie in evidenza/2016/26.08.2016 - Terremoto Centro Italia PC-CRI-CARITAS.pdf"" target=""_blank"">Scarica il documento</a></font></p>";2016-08-30 00:00:00.000;2026-08-30 23:59:59.000;2016-08-30 09:11:24.000;2016-08-30 00:00:00.000;2016-08-30 09:11:58.000;661;N;;NULL;NULL;S
1957;32;94;A;CONSORZIO DI BONIFICA DUGALI - NAVILGIO - ADDA SERIO;"<p><a href=""/public/upload/file/Notizie in evidenza/avviso nuovo piano Dunas.pdf"">NUOVO PIANO DI CLASSIFICA PER IL RIPARTO DEGLI ONERI CONSORTILI DI CONTRIBUENZA AI SENSI DEL R.D. 215/1933 E R.L. 31/2008</a></p>";"<p><a href=""/public/upload/file/Notizie in evidenza/avviso nuovo piano Dunas.pdf"">NUOVO PIANO DI CLASSIFICA PER IL RIPARTO DEGLI ONERI CONSORTILI DI CONTRIBUENZA AI SENSI DEL R.D. 215/1933 E R.L. 31/2008</a></p>";2016-08-22 00:00:00.000;2017-03-22 23:59:59.000;2016-08-22 15:14:03.000;NULL;2016-09-15 14:49:01.000;659;N;;NULL;NULL;NULL
1956;32;94;A;BIMBI A BORDO ESTATE SICURA 2016;"<p><a href=""/public/upload/file/estate sicura 2016/Locandina BIMBI IN AUTO.pdf"">Locandina BIMBI IN AUTO</a></p>  <p><a href=""/public/upload/file/estate sicura 2016/MAI lasciare i bambini soli in auto.pdf"">MAI lasciare i bambini soli in auto</a></p>";"<p><a href=""/public/upload/file/estate sicura 2016/Locandina BIMBI IN AUTO.pdf"">Locandina BIMBI IN AUTO</a></p>  <p><a href=""/public/upload/file/estate sicura 2016/MAI lasciare i bambini soli in auto.pdf"">MAI lasciare i bambini soli in auto</a></p>";2016-08-03 00:00:00.000;2026-12-19 23:59:59.000;2016-08-03 14:44:03.000;2016-08-03 00:00:00.000;2016-08-22 15:09:19.000;659;N;;NULL;NULL;NULL
1955;32;94;A;ESTATE SICURA 2016;"<p><a href=""/public/upload/file/Decalogo sicurezza nel frigorifero.pdf"">Decalogo sicurezza nel frigorifero</a></p>  <p><a href=""/public/upload/file/estate sicura 2016/Consigli alla popolazione_come afforntare il caldo.pdf"">Consigli alla popolazione su come affrontare il caldo</a></p>  <p><a href=""/public/upload/file/estate sicura 2016/Raccomandazioni per assistenza anziani_ita.pdf"">Raccomandazioni per assistenza anziani (Italiano)</a></p>  <p><a href=""/public/upload/file/estate sicura 2016/Raccomandazioni per assistenza anziani_ingl..pdf"">Raccomandazioni per assistenza anziani (English)</a></p>  <p><a href=""/public/upload/file/estate sicura 2016/Raccomandazioni per assistenza anziani_fra.pdf"">Raccomandazioni per assistenza anziani (Fran&ccedil;ais)</a></p>  <p><a href=""/public/upload/file/estate sicura 2016/Raccomandazioni per assistenza anziani_polacco.pdf"">Raccomandazioni per assistenza anziani (Polski)</a></p>  <p><a href=""/public/upload/file/estate sicura 2016/Raccomandazioni per assistenza anziani_spa.pdf"">Raccomandazioni per assistenza anziani (Espa&ntilde;ol)</a></p>  <p><a href=""/public/upload/file/estate sicura 2016/Raccomandazioni per assistenza anziani_russo.pdf"">Raccomandazioni per assistenza anziani (P&#1091;&#1089;&#1089;&#1082;&#1080;&#1081;)</a></p>  <p><a href=""/public/upload/file/estate sicura 2016/Raccomandazioni per assistenza anziani_rumeno.pdf"">Raccomandazioni per assistenza anziani (Rom&acirc;nesc)</a></p>  <p>&nbsp;</p>";"<p><a href=""/public/upload/file/Decalogo sicurezza nel frigorifero.pdf"">Decalogo sicurezza nel frigorifero</a></p>  <p><a href=""/public/upload/file/estate sicura 2016/Consigli alla popolazione_come afforntare il caldo.pdf"">Consigli alla popolazione su come affrontare il caldo</a></p>  <p><a href=""/public/upload/file/estate sicura 2016/Raccomandazioni per assistenza anziani_ita.pdf"">Raccomandazioni per assistenza anziani (Italiano)</a></p>  <p><a href=""/public/upload/file/estate sicura 2016/Raccomandazioni per assistenza anziani_ingl..pdf"">Raccomandazioni per assistenza anziani (English)</a></p>  <p><a href=""/public/upload/file/estate sicura 2016/Raccomandazioni per assistenza anziani_fra.pdf"">Raccomandazioni per assistenza anziani (Fran&ccedil;ais)</a></p>  <p><a href=""/public/upload/file/estate sicura 2016/Raccomandazioni per assistenza anziani_polacco.pdf"">Raccomandazioni per assistenza anziani (Polski)</a></p>  <p><a href=""/public/upload/file/estate sicura 2016/Raccomandazioni per assistenza anziani_spa.pdf"">Raccomandazioni per assistenza anziani (Espa&ntilde;ol)</a></p>  <p><a href=""/public/upload/file/estate sicura 2016/Raccomandazioni per assistenza anziani_russo.pdf"">Raccomandazioni per assistenza anziani (P&#1091;&#1089;&#1089;&#1082;&#1080;&#1081;)</a></p>  <p><a href=""/public/upload/file/estate sicura 2016/Raccomandazioni per assistenza anziani_rumeno.pdf"">Raccomandazioni per assistenza anziani (Rom&acirc;nesc)</a></p>  <p>&nbsp;</p>";2016-08-03 00:00:00.000;2018-12-31 23:59:59.000;2016-08-03 14:40:51.000;2016-08-03 00:00:00.000;NULL;659;N;;NULL;NULL;NULL
1954;32;94;A;Servizio Civile 2016;"<p><img height=""288"" width=""200"" vspace=""15"" hspace=""15"" border=""0"" align=""left"" src=""/public/upload/image/Camisano/Notizie in evidenza/serviziocivile.png"" alt="""" /><font size=""3""><strong><font face=""Verdana"">SERVIZIO CIVILE NAZIONALE 2016</font></strong></font></p>  <p><font face=""Verdana"" size=""2""><!--[if gte mso 9]><xml>  <o:OfficeDocumentSettings>  <o:TargetScreenSize>800x600</o:TargetScreenSize>  </o:OfficeDocumentSettings>  </xml><![endif]--></font><font face=""Verdana"" size=""2"">Presentazione delle domande<br />  <br />  </font><font face=""Verdana"" size=""2"">La domanda di partecipazione, indirizzata direttamente al Comune di Camisano che realizza il progetto prescelto, deve pervenire allo stesso entro e non oltre le ore <strong><font size=""3"">14.00 del 30 giugno 2016. </font></strong></font></p>  <p><a href=""http://www.comune.camisano.cr.it/news/leggi_area.asp?ART_ID=1954&amp;ARE_ID=32&amp;MEC_ID=129&amp;MEC_IDFiglie=&amp;MGRCONTROL=S""><font size=""3""><font face=""Verdana"">CONTINUA A LEGGERE</font></font></a></p>";"<p><img height=""288"" width=""200"" vspace=""15"" hspace=""15"" border=""0"" align=""left"" src=""/public/upload/image/Camisano/Notizie in evidenza/serviziocivile.png"" alt="""" /><strong><font face=""Verdana"" size=""2"">SERVIZIO CIVILE NAZIONALE 2016</font></strong></p>  <p><font face=""Verdana"" size=""2""><!--[if gte mso 9]><xml>  <o:OfficeDocumentSettings>  <o:TargetScreenSize>800x600</o:TargetScreenSize>  </o:OfficeDocumentSettings>  </xml><![endif]--></font><font face=""Verdana"" size=""2"">Presentazione delle domande<br />  <br />  </font><font face=""Verdana"" size=""2"">La domanda di partecipazione, indirizzata direttamente al Comune di Camisano che realizza il progetto prescelto, deve pervenire allo stesso entro e non oltre le ore <strong><font size=""3"">14.00 del 30 giugno 2016. </font></strong></font><br />  <br />  <font face=""Verdana"" size=""2"">Le domande pervenute oltre il termine stabilito non saranno prese in considerazione. </font><br />  <font face=""Verdana"" size=""2"">La domanda, firmata dal richiedente, deve essere: </font><br />  <font face=""Verdana"" size=""2""><strong>-</strong> redatta secondo il modello riportato nell&rsquo;<font size=""3""><a target=""_blank"" href=""/public/upload/file/Notizie in evidenza/2016/servizio civile/Allegato_2_.pdf""><strong>Allegato 2</strong></a></font> al presente bando, attenendosi scrupolosamente alle istruzioni riportate in calce al modello stesso e avendo cura di indicare la sede per la quale si intende concorrere; </font><br />  <font face=""Verdana"" size=""2""><strong>-</strong> accompagnata da fotocopia di valido documento di identit&agrave; personale; </font><br />  <font face=""Verdana"" size=""2""><strong>-</strong> corredata dalla scheda di cui all&rsquo;<font size=""3""><a target=""_blank"" href=""/public/upload/file/Notizie in evidenza/2016/servizio civile/Allegato_3_2016.pdf""><strong>Allegato 3</strong></a></font>, contenente i dati relativi ai titoli. </font><br />  <br />  <font face=""Verdana"" size=""2"">Le domande possono essere presentate esclusivamente secondo le seguenti modalit&agrave;: </font></p>  <p><font face=""Verdana"" size=""2""><strong>1)</strong>&nbsp;&nbsp; con Posta Elettronica Certificata (PEC) - art. 16-bis, comma 5 della legge 28 gennaio 2009, n. 2 - di cui &egrave; titolare l&rsquo;interessato, avendo cura di allegare tutta la documentazione richiesta in formato pdf;<strong><br />  comune.camisano@pec.regione.lombardia.it<br />  </strong></font><br />  <font face=""Verdana"" size=""2""><strong>2)</strong>&nbsp;&nbsp; a mezzo &ldquo;raccomandata A/R&rdquo; al seguente indirizzo:<br />  Comune di Camisano<br />  Piazza Maggiore, 10<br />  26010 Camisano &ndash; CR &ndash;</font></p>  <p><font face=""Verdana"" size=""2""><strong>3)</strong>&nbsp;&nbsp; onsegnate a mano.</font></p>  <p><strong>P<font face=""Verdana"" size=""2"">er informazioni rivolgersi all&rsquo;Ufficio Servizio Sociale - tel. 0373/77212</font></strong><br />  <strong>     </strong>     <strong><font face=""Verdana"" size=""2"">Gioved&igrave; dalle ore 14.00 alle ore 16.00</font></strong><br />  <strong><font face=""Verdana"" size=""2"">     Mercoled&igrave; dalle ore 9.00 alle ore 10.30</font></strong></p>  <p><font face=""Verdana"" size=""2"">Locandina <a target=""_blank"" href=""/public/upload/file/Notizie in evidenza/2016/servizio civile/servizio_civile_a4.pdf""><img vspace=""1"" hspace=""1"" border=""0"" align=""absMiddle"" alt="""" src=""/KlanEditorTestuale/editor/images/smiley/msn/confused_smile.gif"" /></a></font></p>  <p><font size=""2""> </font></p>  <p><font face=""Verdana"" size=""3""><font size=""2"">Presentazione domanda</font> </font><font face=""Verdana"" size=""3""><a target=""_blank"" href=""/public/upload/file/Notizie in evidenza/2016/servizio civile/presentazione domande.doc""><img vspace=""1"" hspace=""1"" border=""0"" align=""absMiddle"" alt="""" src=""/KlanEditorTestuale/editor/images/smiley/msn/confused_smile.gif"" /></a></font></p>  <p><font face=""Verdana"" size=""2"">Allegato 2 </font><font face=""Verdana"" size=""3""><a target=""_blank"" href=""/public/upload/file/Notizie in evidenza/2016/servizio civile/Allegato_2_.pdf""><img vspace=""1"" hspace=""1"" border=""0"" align=""absMiddle"" alt="""" src=""/KlanEditorTestuale/editor/images/smiley/msn/confused_smile.gif"" /></a></font></p>  <p><font face=""Verdana"" size=""2"">Allegato 3 </font><font face=""Verdana"" size=""3""><a target=""_blank"" href=""/public/upload/file/Notizie in evidenza/2016/servizio civile/Allegato_3_2016.pdf""><img vspace=""1"" hspace=""1"" border=""0"" align=""absMiddle"" alt="""" src=""/KlanEditorTestuale/editor/images/smiley/msn/confused_smile.gif"" /></a></font></p>";2016-06-08 00:00:00.000;2026-06-08 23:59:59.000;2016-06-08 10:40:27.000;2016-06-08 00:00:00.000;2016-09-14 09:57:15.000;661;N;;NULL;NULL;NULL
1949;32;94;A;Relazione sui risultati del piano operativo razionalizzazione societ partecipate;"<p><a href=""/public/upload/file/pdf/2016/RELAZIONE SUI RISULTATI DEL PIANO OPERATIVO RAZIONALIZZAZIONE SOCIET. E PARTECIPATE ART.1 COMMA 612 L.190 DEL 2014.pdf""><img border=""0"" align=""absMiddle"" src=""/KlanEditorTestuale/editor/images/smiley/msn/confused_smile.gif"" alt="""" /></a> Relazione sui risultati del piano operativo razionalizzazione societ&agrave; partecipate</p>";"<p><a href=""/public/upload/file/pdf/2016/RELAZIONE SUI RISULTATI DEL PIANO OPERATIVO RAZIONALIZZAZIONE SOCIET. E PARTECIPATE ART.1 COMMA 612 L.190 DEL 2014.pdf""><img border=""0"" align=""absMiddle"" src=""/KlanEditorTestuale/editor/images/smiley/msn/confused_smile.gif"" alt="""" /></a> Relazione sui risultati del piano operativo razionalizzazione societ&agrave; partecipate</p>";2016-04-08 00:00:00.000;2026-03-24 23:59:59.000;2016-04-08 09:19:56.000;2016-04-08 00:00:00.000;2016-04-08 09:20:59.000;661;N;;NULL;NULL;S
