ART_ID;ART_IDArea;ART_IDCategoria;ART_IDStato;ART_Titolo;abstract;ART_Testo;ART_DataInizioPubblicazione;ART_DataFinePubblicazione;ART_DataPubblicazione;ART_DataPubblicazionex;ART_DataUltimaModifica;ART_IDUtente;ART_Inviata;ART_Link;ART_Commento;ART_RuoliDocumento;ART_Evidenza
2048;32;94;A;Bonus Famiglia;"<p><img src=""/public/upload/image/0001.jpg"" alt="""" width=""197"" height=""280"" /></p>  <p>&Egrave; un sostegno economico di 1.500 euro per le famiglie in condizioni di vulnerabilit&agrave; in cui la  donna sia in stato di gravidanza o famiglie che adottano un figlio, nel  periodo compreso tra il 1&deg; gennaio e il 30 giugno 2019.<br />  Il Bonus  Famiglia pu&ograve; essere richiesto anche dalle famiglie monogenitoriali. Il  contributo viene erogato in due rate in caso di gravidanza e in unica  rata in caso di adozione..</p>  <p><strong>Allegati:</strong></p>  <p><a href=""/public/upload/file/LOCANDINA(1).pdf"" target=""_blank""><img src=""http://www.comune.pieranica.cr.it/KlanEditorTestuale/editor/images/smiley/msn/confused_smile.gif"" alt="""" border=""0"" align=""absMiddle"" />Locandina</a></p>  <p><a href=""/public/upload/file/ALLEGATO A.pdf"" target=""_blank""><img src=""http://www.comune.pieranica.cr.it/KlanEditorTestuale/editor/images/smiley/msn/confused_smile.gif"" alt="""" border=""0"" align=""absMiddle"" />Misura Bonus Famiglia</a></p>";"<p><img src=""/public/upload/image/0001.jpg"" alt="""" width=""197"" height=""280"" /></p>  <p>Sostegno economico di 1.500 euro per le famiglie in condizioni di vulnerabilit&agrave; in cui la donna sia in stato di gravidanza o famiglie che adottano un figlio, nel periodo compreso tra il 1&deg; gennaio e il 30 giugno 2019.<br />  Il Bonus Famiglia pu&ograve; essere richiesto anche dalle famiglie monogenitoriali. Il contributo viene erogato in due rate in caso di gravidanza e in unica rata in caso di adozione.</p>  <p><strong>Allegati:</strong></p>  <p><a href=""/public/upload/file/LOCANDINA(1).pdf"" target=""_blank""><img src=""http://www.comune.pieranica.cr.it/KlanEditorTestuale/editor/images/smiley/msn/confused_smile.gif"" alt="""" border=""0"" align=""absMiddle"" />Locandina</a></p>  <p><a href=""/public/upload/file/ALLEGATO A.pdf"" target=""_blank""><img src=""http://www.comune.pieranica.cr.it/KlanEditorTestuale/editor/images/smiley/msn/confused_smile.gif"" alt="""" border=""0"" align=""absMiddle"" />Misura Bonus Famiglia</a></p>";2019-02-28 00:00:00.000;2022-08-08 23:59:59.000;2019-02-28 15:13:40.000;1899-12-30 00:00:00.000;2019-03-27 12:28:21.000;659;N;;NULL;NULL;S
2047;32;94;A;Itinerari percorribili per veicoli eccezionali;"<p><font size=""3"" face=""Verdana""><img src=""/public/upload/image/file immagine pe rlink.jpg"" alt="""" width=""200"" height=""154"" /></font></p>  <p><font size=""3"" face=""Verdana"">Itinerari percorribili per veicoli eccezionali e trasporti in condizioni di eccezionalit&agrave;.</font></p>  <ul>      <li><a href=""/public/upload/File/CAMISANO Allegati Circolazione di trasporti e veicoli in condizioni di eccezionalit&agrave;. Strade percorribili di competenza comunale.pdf"" target=""_blank""><font size=""3"" face=""Verdana"">Scarica documento</font><img src=""http://www.comune.pieranica.cr.it/KlanEditorTestuale/editor/images/smiley/msn/confused_smile.gif"" alt="""" border=""0"" align=""absMiddle"" /></a></li>  </ul>";"<p>&nbsp;</p>  <p><font size=""3"" face=""Verdana""><img src=""/public/upload/image/file immagine pe rlink.jpg"" alt="""" width=""200"" height=""154"" /></font></p>  <p><font size=""3"" face=""Verdana"">Itinerari percorribili per veicoli eccezionali e trasporti in condizioni di eccezionalit&agrave;.</font></p>  <ul>      <li><a href=""/public/upload/File/CAMISANO Allegati Circolazione di trasporti e veicoli in condizioni di eccezionalit&agrave;. Strade percorribili di competenza comunale.pdf"" target=""_blank""><font size=""3"" face=""Verdana"">Scarica documento</font><img src=""http://www.comune.pieranica.cr.it/KlanEditorTestuale/editor/images/smiley/msn/confused_smile.gif"" alt="""" border=""0"" align=""absMiddle"" /></a></li>  </ul>";2019-02-19 00:00:00.000;2022-09-11 23:59:59.000;2019-02-19 09:50:38.000;NULL;2019-07-19 09:02:43.000;661;N;;NULL;NULL;S
2046;32;94;A;Nuovi moduli edilizi unificati Regione Lombardia;"<div align=""center"">  <p><strong><span style=""color: rgb(47, 57, 65); font-family: system-ui, -apple-system, BlinkMacSystemFont, "" segoe="""" font-size:="""" font-style:="""" font-variant-ligatures:="""" font-variant-caps:="""" letter-spacing:="""" text-align:="""" text-indent:="""" text-transform:="""" white-space:="""" word-spacing:="""" background-color:="""" text-decoration-style:="""" text-decoration-color:="""" display:="""" inline="""" float:=""""><font color=""#000000""><span class=""titolo_grande"">Nuovi moduli edilizi unificati Regione Lombardia</span></font></span></strong></p>  <p>&nbsp;</p>  <p><a href=""http://www.regione.lombardia.it/wps/portal/istituzionale/HP/DettaglioServizio/servizi-e-informazioni/enti-e-operatori/territorio/moduli-edilizi-unificati"" target=""_blank"" rel=""nofollow noreferrer"" style=""color: rgb(31, 115, 183); text-decoration: none; margin: 0px; padding: 0px; font-size: 14px; vertical-align: baseline; background: rgb(255, 255, 255); cursor: pointer; font-family: system-ui, -apple-system, BlinkMacSystemFont, "" segoe="""" font-style:="""" font-variant-ligatures:="""" font-variant-caps:="""" font-weight:="""" letter-spacing:="""" orphans:="""" text-align:="""" text-indent:="""" text-transform:="""" white-space:="""" widows:="""" word-spacing:="""">http://www.regione.lombardia.it/wps/portal/istituzionale/HP/DettaglioServizio/servizi-e-informazioni/enti-e-operatori/territorio/moduli-edilizi-unificati</a></p>  </div>";"<div align=""center"">  <p><strong><span style=""font-family: system-ui, -apple-system, BlinkMacSystemFont, "" segoe="""" font-size:="""" font-style:="""" font-variant-ligatures:="""" font-variant-caps:="""" letter-spacing:="""" text-align:="""" text-indent:="""" text-transform:="""" white-space:="""" word-spacing:="""" background-color:="""" text-decoration-style:="""" text-decoration-color:="""" display:="""" inline="""" float:=""""><span class=""titolo_grande"">Nuovi moduli edilizi unificati Regione Lombardia</span></span></strong></p>  <p>&nbsp;</p>  <p><a href=""http://www.regione.lombardia.it/wps/portal/istituzionale/HP/DettaglioServizio/servizi-e-informazioni/enti-e-operatori/territorio/moduli-edilizi-unificati"" target=""_blank"" rel=""nofollow noreferrer"" style=""color: rgb(31, 115, 183); text-decoration: none; margin: 0px; padding: 0px; font-size: 14px; vertical-align: baseline; background: rgb(255, 255, 255); cursor: pointer; font-family: system-ui, -apple-system, BlinkMacSystemFont, "" segoe="""" font-style:="""" font-variant-ligatures:="""" font-variant-caps:="""" font-weight:="""" letter-spacing:="""" orphans:="""" text-align:="""" text-indent:="""" text-transform:="""" white-space:="""" widows:="""" word-spacing:="""">http://www.regione.lombardia.it/wps/portal/istituzionale/HP/DettaglioServizio/servizi-e-informazioni/enti-e-operatori/territorio/moduli-edilizi-unificati</a></p>  </div>";2019-02-18 00:00:00.000;2025-07-09 23:59:59.000;2019-02-18 09:37:37.000;NULL;2019-02-18 09:40:11.000;661;N;;NULL;NULL;S
2045;32;94;A;VOUCHER ANZIANI E DISABILI 2019/2020;"<p><img width=""188"" height=""172"" alt="""" src=""/public/upload/Image/Immagine 1.png"" /></p>";"<p><span style=""color: rgb(105, 105, 105); font-family: Lato, sans-serif; font-size: 12px; font-style: normal; font-variant-ligatures: normal; font-variant-caps: normal; font-weight: 400; letter-spacing: normal; orphans: 2; text-align: start; text-indent: 0px; text-transform: none; white-space: normal; widows: 2; word-spacing: 0px; -webkit-text-stroke-width: 0px; background-color: rgb(255, 255, 255); text-decoration-style: initial; text-decoration-color: initial; display: inline !important; float: none;"">Interventi per migliorare la qualit&agrave; della vita delle persone anziane e favorire l&rsquo;inclusione sociale delle persone disabili.</span></p>  <p><a href=""/public/upload/File/Brochure.pdf""><img src=""http://www.comune.castelgabbiano.cr.it/modules/file/icons/application-pdf.png"" alt=""PDF icon"" />Brochure</a></p>  <p><a href=""/public/upload/File/locandina.pdf""><img src=""http://www.comune.castelgabbiano.cr.it/modules/file/icons/application-pdf.png"" alt=""PDF icon"" />Locandina</a></p>";2019-02-06 00:00:00.000;2022-05-17 23:59:59.000;2019-02-06 14:50:54.000;NULL;2019-02-06 14:54:00.000;659;N;;NULL;NULL;S
2044;32;94;A;ELEZIONI PARLAMENTO EUROPEO 2019;"<p><img src=""/public/upload/image/img_notizie/elezionieuropee2019.jpg"" alt="""" width=""263"" vspace=""5"" hspace=""5"" height=""157"" border=""0"" align=""left"" /></p>  <p>&nbsp;</p>  <p>&nbsp;</p>  <p>&nbsp;</p>  <p>&nbsp;</p>  <p>&nbsp;</p>  <p>&nbsp;</p>  <p>&nbsp;</p>  <p>ELEZIONE DEI MEMBRI DEL PARLAMENTO EUROPEO SPETTANTI ALL&rsquo;ITALIA DA PARTE DEI CITTADINI DELL&rsquo;UNIONE</p>  <p><font size=""2""><font face=""Verdana""><a href=""/public/upload/file/Archivio avvisi pubblicati/2019/EsercizioVotoCittadiniUE-Manifesto Informativo.rtf"" target=""_blank""><font size=""2""><font face=""Verdana""><img src=""/KlanEditorTestuale/editor/images/smiley/msn/confused_smile.gif"" alt="""" border=""0"" align=""absMiddle"" /></font></font></a></font></font><font size=""2""><font face=""Verdana"">Manifesto</font></font></p>  <p><font size=""2"" face=""Verdana""><a href=""/public/upload/file/Archivio avvisi pubblicati/2019/sercizioVotoCittadiniUE-modulo richiesta.pdf""><img src=""/KlanEditorTestuale/editor/images/smiley/msn/regular_smile.gif"" alt="""" border=""0"" align=""absMiddle"" /></a></font><font size=""2""><font face=""Verdana""><font size=""2""><font face=""Verdana"">Modulo di richiesta per cittadini UE</font></font></font></font></p>";"<p dir=""auto"" style=""margin: 0px 0px 16px; font-family: system-ui, -apple-system, BlinkMacSystemFont, "" segoe="""" font-size:="""" line-height:="""" padding:="""" border:="""" outline:="""" vertical-align:="""" background:="""" color:="""" font-style:="""" font-variant-ligatures:="""" font-variant-caps:="""" font-weight:="""" letter-spacing:="""" orphans:="""" text-align:="""" text-indent:="""" text-transform:="""" white-space:="""" widows:="""" word-spacing:="""" text-decoration-style:="""" text-decoration-color:="""">ELEZIONE DEI MEMBRI DEL PARLAMENTO EUROPEO SPETTANTI ALL&rsquo;ITALIA DA PARTE DEI CITTADINI DELL&rsquo;UNIONE</p>  <p dir=""auto"" style=""margin: 0px 0px 16px; font-family: system-ui, -apple-system, BlinkMacSystemFont, "" segoe="""" font-size:="""" line-height:="""" padding:="""" border:="""" outline:="""" vertical-align:="""" background:="""" color:="""" font-style:="""" font-variant-ligatures:="""" font-variant-caps:="""" font-weight:="""" letter-spacing:="""" orphans:="""" text-align:="""" text-indent:="""" text-transform:="""" white-space:="""" widows:="""" word-spacing:="""" text-decoration-style:="""" text-decoration-color:="""">&nbsp;</p>  <p dir=""auto"" style=""margin: 0px 0px 16px; font-family: system-ui, -apple-system, BlinkMacSystemFont, "" segoe="""" font-size:="""" line-height:="""" padding:="""" border:="""" outline:="""" vertical-align:="""" background:="""" color:="""" font-style:="""" font-variant-ligatures:="""" font-variant-caps:="""" font-weight:="""" letter-spacing:="""" orphans:="""" text-align:="""" text-indent:="""" text-transform:="""" white-space:="""" widows:="""" word-spacing:="""" text-decoration-style:="""" text-decoration-color:=""""><font size=""2""><font face=""Verdana""><a href=""/public/upload/file/Archivio avvisi pubblicati/2019/EsercizioVotoCittadiniUE-Manifesto Informativo.rtf"" target=""_blank""><font size=""2""><font face=""Verdana""><img src=""/KlanEditorTestuale/editor/images/smiley/msn/confused_smile.gif"" alt="""" border=""0"" align=""absMiddle"" /></font></font></a></font></font><font size=""2""><font face=""Verdana"">Manifesto</font></font></p>  <p dir=""auto"" style=""margin: 0px 0px 16px; font-family: system-ui, -apple-system, BlinkMacSystemFont, "" segoe="""" font-size:="""" line-height:="""" padding:="""" border:="""" outline:="""" vertical-align:="""" background:="""" color:="""" font-style:="""" font-variant-ligatures:="""" font-variant-caps:="""" font-weight:="""" letter-spacing:="""" orphans:="""" text-align:="""" text-indent:="""" text-transform:="""" white-space:="""" widows:="""" word-spacing:="""" text-decoration-style:="""" text-decoration-color:=""""><font size=""2"" face=""Verdana""><a href=""/public/upload/file/Archivio avvisi pubblicati/2019/sercizioVotoCittadiniUE-modulo richiesta.pdf""><img src=""/KlanEditorTestuale/editor/images/smiley/msn/regular_smile.gif"" alt="""" border=""0"" align=""absMiddle"" /></a></font><font size=""2""><font face=""Verdana""><font size=""2""><font face=""Verdana"">Modulo di richiesta per cittadini UE<br />  </font></font></font></font></p>";2019-01-30 00:00:00.000;2022-12-31 23:59:59.000;2019-01-30 11:44:11.000;2019-01-30 00:00:00.000;2019-01-30 11:55:21.000;661;N;;NULL;NULL;S
2036;32;94;A;"CARTA D&#39;IDENTITA&#39; ELETTRONICA";"<p><img src=""/public/upload/image/carta-elettronica.jpg"" alt="""" width=""328"" height=""184"" /></p>  <p><a href=""/public/upload/file/INFORMAZIONI GENERALI.pdf""><img src=""/KlanEditorTestuale/editor/images/smiley/msn/confused_smile.gif"" alt="""" border=""0"" align=""absMiddle"" /> Informazioni generali<br />  </a></p>";"<p>&nbsp;</p>  <p><img src=""/public/upload/image/carta-elettronica.jpg"" alt="""" width=""328"" height=""184"" /></p>  <p>&nbsp;</p>  <p>&nbsp;</p>  <p>&nbsp;<a href=""/public/upload/file/INFORMAZIONI GENERALI.pdf""><img src=""/KlanEditorTestuale/editor/images/smiley/msn/confused_smile.gif"" alt="""" border=""0"" align=""absMiddle"" /> Informazioni generali</a></p>";2018-08-08 00:00:00.000;2025-12-31 23:59:59.000;2018-08-08 11:47:03.000;NULL;2018-08-08 11:54:24.000;661;N;;NULL;NULL;S
2030;32;94;A;GDPR REGOLAMENTO UE 2016/679 DEL 27 APRILE 2016;"<p><font size=""2"" face=""Verdana""><strong>COMUNICAZINE RECAPITI DPO-RESPONSABILE DELLA PROTEZIONE DEI DATI PERSONALI </strong></font></p>  <p align=""justify""><font size=""2"" face=""Verdana"">Questa amministrazione &egrave; titolare del trattamento di dati personali necessari alle proprie finalit&agrave; istituzionali e ha nominato Responsabile Comunale della Protezione dei Dati Personali, a cui gli interessati possono rivolgersi per tutte le questioni relative al trattamento dei loro dati personali e all&rsquo;esercizio dei loro diritti derivanti dalla normativa nazionale e comunitaria in materia di protezione dei dati personali: </font></p>  <p><strong><font size=""2"" face=""Verdana"">Funzione e titolo: DPO- Responsabile Comunale della Protezione dei Dati Personali <br />  Cognome e Nome: AVV. Alessandro OVADIA<br />  </font></strong><strong><font size=""2"" face=""Verdana""><strong><font size=""2"" face=""Verdana"">E MAIL dpo@consorzioit.net pec a.ovadia@legalmail.it<br />  </font></strong><br />  </font></strong></p>";"<p><font size=""2"" face=""Verdana""><strong>COMUNICAZINE RECAPITI DPO-RESPONSABILE DELLA PROTEZIONE DEI DATI PERSONALI </strong></font></p>  <p align=""justify""><font size=""2"" face=""Verdana"">Questa amministrazione &egrave; titolare del trattamento di dati personali necessari alle proprie finalit&agrave; istituzionali e ha nominato Responsabile Comunale della Protezione dei Dati Personali, a cui gli interessati possono rivolgersi per tutte le questioni relative al trattamento dei loro dati personali e all&rsquo;esercizio dei loro diritti derivanti dalla normativa nazionale e comunitaria in materia di protezione dei dati personali: </font></p>  <p><strong><font size=""2"" face=""Verdana"">Funzione e titolo: DPO- Responsabile Comunale della Protezione dei Dati Personali <br />  Cognome e Nome: AVV. Alessandro OVADIA <br />  E MAIL dpo@consorzioit.net pec a.ovadia@legalmail.it<br />  </font></strong></p>";2018-05-25 00:00:00.000;2028-05-25 23:59:59.000;2018-05-25 14:37:29.000;2018-05-25 00:00:00.000;2018-05-29 14:16:30.000;661;N;;NULL;NULL;S
2017;32;94;A;Reperibilit ufficiale dello stato Civile;"<p><font size=""3""><font face=""Verdana"">Reperibilit&agrave; dell'Ufficiale dello Stato Civile per Denunce di Morte</font></font></p>  <p><font size=""3""><font face=""Verdana"">Comunicazione <a href=""/public/upload/file/Notizie in evidenza/2017/REPERIBILITA'.doc"" target=""_blank""><img src=""/KlanEditorTestuale/editor/images/smiley/msn/confused_smile.gif"" alt="""" align=""absMiddle"" border=""0"" /></a></font></font></p>";"<p><font size=""3""><font face=""Verdana"">Reperibilit&agrave; dell'Ufficiale dello Stato Civile per Denunce di Morte</font></font></p>  <p><font size=""3""><font face=""Verdana"">Comunicazione <a href=""/public/upload/file/Notizie in evidenza/2017/REPERIBILITA'.doc"" target=""_blank""><img src=""/KlanEditorTestuale/editor/images/smiley/msn/confused_smile.gif"" alt="""" align=""absMiddle"" border=""0"" /></a></font></font></p>";2017-12-21 00:00:00.000;2027-12-21 23:59:59.000;2017-12-21 15:32:50.000;2017-12-21 00:00:00.000;2017-12-21 15:32:55.000;661;N;;NULL;NULL;S
2011;32;94;A;Ambito territoriale cremasco - Avviso pubblico;"<div align=""center"">  <p><img src=""/public/upload/image/Camisano/2017/Notizie in evidenza/avvisopubblico.png"" alt="""" width=""350"" height=""90"" border=""0"" /></p>  <p><font size=""2"" face=""Verdana"">per l'erogazione di contributi volti al contenimento dell'emergenza abitativa a favore di famiglie con morosit&agrave; incolpevole ridotta<br />  </font><br />  <a href=""/public/upload/file/Notizie in evidenza/2017/Avviso pubblico servizi abitativi.pdf"" target=""_blank""><img src=""/KlanEditorTestuale/editor/images/smiley/msn/confused_smile.gif"" alt="""" border=""0"" align=""absMiddle"" /></a><font size=""2"" face=""Verdana"">Avviso</font></p>  </div>";"<div align=""center"">  <p><img src=""/public/upload/image/Camisano/2017/Notizie in evidenza/avvisopubblico.png"" alt="""" width=""350"" height=""90"" border=""0"" /></p>  <p><font size=""2"" face=""Verdana"">per l'erogazione di contributi volti al contenimento dell'emergenza abitativa a favore di famiglie con morosit&agrave; incolpevole ridotta<br />  </font><br />  <a href=""/public/upload/file/Notizie in evidenza/2017/Avviso pubblico servizi abitativi.pdf"" target=""_blank""><img src=""/KlanEditorTestuale/editor/images/smiley/msn/confused_smile.gif"" alt="""" border=""0"" align=""absMiddle"" /></a><font size=""2"" face=""Verdana"">Avviso</font></p>  </div>";2017-10-11 00:00:00.000;2027-10-11 23:59:59.000;2017-10-11 14:19:22.000;2017-10-11 00:00:00.000;2017-12-13 14:53:05.000;661;N;;NULL;NULL;NULL
2010;32;94;A;Io non rischio 2017;"<p><img src=""/public/upload/image/Camisano/2017/Notizie in evidenza/campagna-io-non-rischio-364.jpg"" alt="""" hspace=""5"" height=""148"" width=""200"" vspace=""5"" border=""0"" align=""left"" /><font size=""3""><font face=""Verdana"">Buone pratiche di protezione civile<br />  14 ottobre 2017<br />  </font></font><font size=""3""><font face=""Verdana"">Cremona, piazza Marconi </font></font><font size=""3""><font face=""Verdana""><br />  dalle ore 09.00 alle 18.00</font></font></p>  <p><font size=""3""><font face=""Verdana""><a href=""/public/upload/file/Notizie in evidenza/2017/LOCANDINA_IO_NON_RISCHIO_Cremona.pdf"" target=""_blank""><img src=""/KlanEditorTestuale/editor/images/smiley/msn/confused_smile.gif"" alt="""" border=""0"" align=""absMiddle"" /></a> Locandina</font></font></p>";"<p><img src=""/public/upload/image/Camisano/2017/Notizie in evidenza/campagna-io-non-rischio-364.jpg"" alt="""" hspace=""5"" height=""148"" width=""200"" vspace=""5"" border=""0"" align=""left"" /><font size=""3""><font face=""Verdana"">Buone pratiche di protezione civile<br />  14 ottobre 2017<br />  </font></font><font size=""3""><font face=""Verdana"">Cremona, piazza Marconi </font></font><font size=""3""><font face=""Verdana""><br />  dalle ore 09.00 alle 18.00</font></font></p>  <p><font size=""3""><font face=""Verdana""><a href=""/public/upload/file/Notizie in evidenza/2017/LOCANDINA_IO_NON_RISCHIO_Cremona.pdf"" target=""_blank""><img src=""/KlanEditorTestuale/editor/images/smiley/msn/confused_smile.gif"" alt="""" border=""0"" align=""absMiddle"" /></a> Locandina</font></font></p>";2017-10-11 00:00:00.000;2027-10-11 23:59:59.000;2017-10-11 14:13:46.000;2017-10-11 00:00:00.000;2017-10-18 13:55:37.000;661;N;;NULL;NULL;NULL
1998;32;94;A;Bonus famiglia 2017;"<p><img src=""/public/upload/image/Camisano/Notizie in evidenza/bonus_famiglia_54_2947.jpg"" alt="""" width=""151"" vspace=""5"" hspace=""5"" height=""147"" border=""0"" align=""left"" /><font size=""3""><font face=""Verdana"">Bonus Famiglia 2017</font></font></p>  <p><font size=""2""><font face=""Verdana"">&euro; 1.800 per la nascita/adozione di un figlio da parte di Regione Lombardia</font><br />  </font></p>  <p><font size=""2""><a href=""/public/upload/file/bandi/bonus famiglia.pdf"" target=""_blank"">Scarica il documento</a></font></p>";"<p><img src=""/public/upload/image/Camisano/Notizie in evidenza/bonus_famiglia_54_2947.jpg"" alt="""" width=""151"" vspace=""5"" hspace=""5"" height=""147"" border=""0"" align=""left"" /><font size=""3""><font face=""Verdana"">Bonus Famiglia 2017</font></font></p>  <p><font size=""2""><font face=""Verdana"">&euro; 1.800 per la nascita/adozione di un figlio da parte di Regione Lombardia</font><br />  </font></p>  <p><font size=""2""><a href=""/public/upload/file/bandi/bonus famiglia.pdf"" target=""_blank"">Scarica il documento</a></font></p>";2017-09-07 00:00:00.000;2037-09-07 23:59:59.000;2017-09-07 14:36:46.000;2017-09-07 00:00:00.000;2017-12-13 14:54:12.000;661;N;;NULL;NULL;S
1997;32;94;A;Bonus Asilo Nido 2017;"<p><img src=""/public/upload/image/Camisano/2017/Notizie in evidenza/ASILO NIDO.jpg"" alt="""" width=""300"" vspace=""5"" hspace=""5"" height=""141"" border=""0"" align=""left"" /><font size=""3""><font face=""Verdana"">Bonus Asilo Nido 2017</font></font></p>  <p><font size=""2"">Si avvisa la cittadinanza che i genitori di bimbi e bimbe nati dal 1 Gennaio 2016 possono avanzare la richiesta all'INPS per il bonus da 1.000,00 euri annui-senza limiti di reddito - che contribuisce a saldare le rette per gli asili nido oppure per l'assistenza domiciliare in caso di patologie gravi</font></p>  <p><font size=""2""><a href=""http://public/upload/file/Notizie in evidenza/2017/BONUS ASILI NIDO 2017.pdf"" target=""_blank"">Scarica il documento</a></font></p>";"<p><img src=""/public/upload/image/Camisano/2017/Notizie in evidenza/ASILO NIDO.jpg"" alt="""" width=""300"" vspace=""5"" hspace=""5"" height=""141"" border=""0"" align=""left"" /><font size=""3""><font face=""Verdana"">Bonus Asilo Nido 2017</font></font></p>  <p><font size=""2"">Si avvisa la cittadinanza che i genitori di bimbi e bimbe nati dal 1 Gennaio 2016 possono avanzare la richiesta all'INPS per il bonus da 1.000,00 euri annui-senza limiti di reddito - che contribuisce a saldare le rette per gli asili nido oppure per l'assistenza domiciliare in caso di patologie gravi</font></p>  <p><font size=""2""><a href=""http://public/upload/file/Notizie in evidenza/2017/BONUS ASILI NIDO 2017.pdf"" target=""_blank"">Scarica il documento</a></font></p>";2017-07-19 00:00:00.000;2027-10-19 23:59:59.000;2017-07-19 15:49:32.000;2017-07-19 00:00:00.000;2017-07-19 15:49:39.000;661;N;;NULL;NULL;S
1996;32;94;A;Bimbi in auto;"<div align=""center"">  <p><a href=""/public/upload/file/Notizie in evidenza/2017/Locandina BIMBI IN AUTO.pdf"" target=""_blank""><img src=""/public/upload/image/Camisano/Notizie in evidenza/BIMBIINAUTO.png"" alt="""" width=""350"" height=""500"" border=""0"" align=""absMiddle"" /></a></p>  <p><a href=""/public/upload/file/Notizie in evidenza/2017/OPUSCOLO MINISTERO SALUTE.pdf"" target=""_blank"">OPUSCOLO MINISTERO DELLA SALUTE</a></p>  </div>";"<div align=""center"">  <p><a href=""/public/upload/file/Notizie in evidenza/2017/Locandina BIMBI IN AUTO.pdf"" target=""_blank""><img src=""/public/upload/image/Camisano/Notizie in evidenza/BIMBIINAUTO.png"" alt="""" width=""350"" height=""500"" border=""0"" align=""absMiddle"" /></a></p>  <p><a href=""/public/upload/file/Notizie in evidenza/2017/OPUSCOLO MINISTERO SALUTE.pdf"" target=""_blank"">OPUSCOLO MINISTERO DELLA SALUTE</a></p>  </div>";2017-06-29 00:00:00.000;2017-06-29 23:59:59.000;2017-06-29 16:25:11.000;2017-06-29 00:00:00.000;2017-06-29 16:25:15.000;661;N;;NULL;NULL;S
1995;32;94;A;Come affrontare il caldo;"<div align=""center"">  <p><img src=""/public/upload/image/Camisano/Notizie in evidenza/calcocamisano.png"" alt="""" height=""508"" width=""350"" /></p>  <p><a href=""/public/upload/file/Notizie in evidenza/2017/COME AFFRONTARE IL CALDO.pdf"" target=""_blank"">SCARICA L'OPUSCOLO</a></p>  </div>";"<div align=""center"">  <p><img src=""/public/upload/image/Camisano/Notizie in evidenza/calcocamisano.png"" alt="""" height=""508"" width=""350"" /></p>  <p><a href=""/public/upload/file/Notizie in evidenza/2017/COME AFFRONTARE IL CALDO.pdf"" target=""_blank"">SCARICA L'OPUSCOLO</a></p>  </div>";2017-06-29 00:00:00.000;2027-06-29 23:59:59.000;2017-06-29 16:21:32.000;2017-06-29 00:00:00.000;2017-10-04 15:12:13.000;661;N;;NULL;NULL;NULL
