ART_ID;ART_IDArea;ART_IDCategoria;ART_IDStato;ART_Titolo;abstract;ART_Testo;ART_DataInizioPubblicazione;ART_DataFinePubblicazione;ART_DataPubblicazione;ART_DataPubblicazionex;ART_DataUltimaModifica;ART_IDUtente;ART_Inviata;ART_Link;ART_Commento;ART_RuoliDocumento;ART_Evidenza
2081;32;94;A;Calendario Rifiuti Anno 2020;"<div align=""center""><a href=""/public/upload/File/Camisano_2020.pdf"" target=""_blank""><img src=""/public/upload/Image/img-104103-O-29-289-0-0-bc98b38d029fc0570a5416325290ce32.jpg"" alt="""" width=""200"" height=""133"" /></a><br />  <a href=""/public/upload/File/Camisano_2020.pdf"" target=""_blank""> <strong>CALENDARIO RIFIUTI 2020</strong></a></div>";"<div align=""center""><a href=""/public/upload/File/Camisano_2020.pdf"" target=""_blank""><img src=""/public/upload/Image/img-104103-O-29-289-0-0-bc98b38d029fc0570a5416325290ce32.jpg"" alt="""" width=""200"" height=""133"" /><br />  <strong>CALENDARIO RIFIUTI 2020</strong></a></div>";2020-01-08 00:00:00.000;2021-01-01 23:59:59.000;2020-01-08 11:32:07.000;NULL;2020-01-08 11:32:14.000;659;N;;NULL;NULL;S
2075;32;94;A;Servizi Abitativi Pubblici SAP;"<p><img src=""/public/upload/Image/Servizi abitativi pubblici.jpg"" alt="""" width=""300"" height=""173"" /></p>  <p>APERTURA E CHIUSURA AVVISO : da luned&igrave; 1<strong>4 ottobre 2019 ore 9.00</strong> a <strong>luned&igrave; 16 dicembre 2019 ore 16.00</strong></p>  <ul>      <li><a href=""/public/upload/File/AVVISO (5).pdf"" target=""_blank""><img src=""/KlanEditorTestuale/editor/images/smiley/msn/confused_smile.gif"" alt="""" />Avviso pubblico</a></li>      <li><a href=""/public/upload/File/ELENCO ALLOGGI SAP sintetico (3).pdf"" target=""_blank""><img src=""/KlanEditorTestuale/editor/images/smiley/msn/confused_smile.gif"" alt="""" />Elenco Alloggi SAP (sintetico)</a></li>      <li><a href=""/public/upload/File/Guida alla compilazione delle domande (6).pdf"" target=""_blank""><img src=""/KlanEditorTestuale/editor/images/smiley/msn/confused_smile.gif"" alt="""" />Guida alla compilazione delle domande</a></li>      <li><a href=""/public/upload/File/modulo richiesta attestazione indigenza ( per i nuclei con indicatore della situazione economica ISEE pari o inferiore a &euro; 3.000,00) (1).pdf"" target=""_blank""><img src=""/KlanEditorTestuale/editor/images/smiley/msn/confused_smile.gif"" alt="""" />modulo richiesta attestazione indigenza ( per i nuclei con indicatore della situazione economica ISEE pari o inferiore a &euro; 3.000,00) </a></li>      <li><a href=""/public/upload/File/NOTA INFORMATIVA DISTRETTO (2).pdf"" target=""_blank""><img src=""/KlanEditorTestuale/editor/images/smiley/msn/confused_smile.gif"" alt="""" />Nota Informativa distretto</a></li>  </ul>  <p>&nbsp;</p>";"<p><img src=""/public/upload/Image/Servizi abitativi pubblici.jpg"" alt="""" width=""300"" height=""173"" /></p>  <p>APERTURA E CHIUSURA AVVISO : da luned&igrave; 1<strong>4 ottobre 2019 ore 9.00</strong> a <strong>luned&igrave; 16 dicembre 2019 ore 16.00</strong></p>  <ul>      <li><a href=""/public/upload/File/AVVISO (5).pdf"" target=""_blank""><img src=""/KlanEditorTestuale/editor/images/smiley/msn/confused_smile.gif"" alt="""" />Avviso pubblico</a></li>      <li><a href=""/public/upload/File/ELENCO ALLOGGI SAP sintetico (3).pdf"" target=""_blank""><img src=""/KlanEditorTestuale/editor/images/smiley/msn/confused_smile.gif"" alt="""" />Elenco Alloggi SAP (sintetico)</a></li>      <li><a href=""/public/upload/File/Guida alla compilazione delle domande (6).pdf"" target=""_blank""><img src=""/KlanEditorTestuale/editor/images/smiley/msn/confused_smile.gif"" alt="""" />Guida alla compilazione delle domande</a></li>      <li><a href=""/public/upload/File/modulo richiesta attestazione indigenza ( per i nuclei con indicatore della situazione economica ISEE pari o inferiore a &euro; 3.000,00) (1).pdf"" target=""_blank""><img src=""/KlanEditorTestuale/editor/images/smiley/msn/confused_smile.gif"" alt="""" />modulo  richiesta attestazione indigenza ( per i nuclei con indicatore della  situazione economica ISEE pari o inferiore a &euro; 3.000,00) </a></li>      <li><a href=""/public/upload/File/NOTA INFORMATIVA DISTRETTO (2).pdf"" target=""_blank""><img src=""/KlanEditorTestuale/editor/images/smiley/msn/confused_smile.gif"" alt="""" />Nota Informativa distretto</a></li>  </ul>  <p>&nbsp;</p>";2019-10-17 00:00:00.000;2025-07-08 23:59:59.000;2019-10-17 16:46:31.000;NULL;2019-10-17 16:46:40.000;659;N;;NULL;NULL;S
2071;32;94;S;BANDO BORSE DI STUDIO AL MERITO 2019;"<p><img src=""/public/upload/Image/borsa-di-studio-770x400-2(1).jpg"" alt="""" width=""400"" height=""208"" /></p>  <p><a href=""/public/upload/File/BANDO BORSE DI STUDIO ANNO SCOL. 2018-19.pdf"" target=""_blank""><img src=""/KlanEditorTestuale/editor/images/smiley/msn/confused_smile.gif"" alt="""" /></a>BANDO BORSE DI STUDIO ANNO SCOL. 2018-19</p>  <p><a href=""/public/upload/File/Moduli domanda borsa di studio.docx"" target=""_blank""><img src=""/KlanEditorTestuale/editor/images/smiley/msn/regular_smile.gif"" alt="""" /></a>MODULI DOMANDA BORSA DI STUDIO</p>";"<p><img src=""/public/upload/Image/borsa-di-studio-770x400-2(1).jpg"" alt="""" width=""400"" height=""208"" /></p>  <p><a href=""/public/upload/File/BANDO BORSE DI STUDIO ANNO SCOL. 2018-19.pdf"" target=""_blank""><img src=""/KlanEditorTestuale/editor/images/smiley/msn/confused_smile.gif"" alt="""" /></a>BANDO BORSE DI STUDIO ANNO SCOL. 2018-19</p>  <p><a href=""/public/upload/File/Moduli domanda borsa di studio.docx"" target=""_blank""><img src=""/KlanEditorTestuale/editor/images/smiley/msn/regular_smile.gif"" alt="""" /></a>MODULI DOMANDA BORSA DI STUDIO</p>";2019-10-11 00:00:00.000;2025-05-10 23:59:59.000;2019-10-11 14:34:15.000;NULL;2020-01-02 15:01:27.000;659;N;;NULL;NULL;S
2069;32;94;A;Dote Scuola 2019/2020 - Seconda edizione;"<p align=""center""><img src=""/public/upload/Image/0001 (9)(1).jpg"" alt="""" width=""100"" height=""141"" /></p>  <p align=""center"">&Egrave; prevista una seconda edizione dell&rsquo;avviso, rivolta unicamente a chi non ha presentato la domanda nella prima edizione. Chi dovesse segnalare una modifica a quanto gi&agrave; inserito non dovr&agrave; presentare una nuova domanda, ma comunicare via posta elettronica all&rsquo;Ufficio Dote scuola le eventuali variazioni.</p>  <p align=""center""><a href=""/public/upload/File/DOTE+SCUOLA++locandina+integrazione.pdf"" target=""_blank""><img src=""/KlanEditorTestuale/editor/images/smiley/msn/confused_smile.gif"" alt="""" />Avviso.pdf</a></p>";"<p align=""center""><img src=""/public/upload/Image/0001 (9)(1).jpg"" alt="""" width=""100"" height=""141"" /></p>  <p align=""center"">&Egrave;  prevista una seconda edizione dell&rsquo;avviso, rivolta unicamente a chi non  ha presentato la domanda nella prima edizione. Chi dovesse segnalare  una modifica a quanto gi&agrave; inserito non dovr&agrave; presentare una nuova  domanda, ma comunicare via posta elettronica all&rsquo;Ufficio Dote scuola le  eventuali variazioni.</p>  <p align=""center""><a href=""/public/upload/File/DOTE+SCUOLA++locandina+integrazione.pdf"" target=""_blank""><img src=""/KlanEditorTestuale/editor/images/smiley/msn/confused_smile.gif"" alt="""" />Avviso.pdf</a></p>";2019-08-28 00:00:00.000;2025-10-13 23:59:59.000;2019-08-28 14:13:10.000;NULL;2019-08-28 14:13:19.000;661;N;;NULL;NULL;S
2067;32;94;A;Avviso alla Cittadinanza;"<div align=""center"">  <p>A seguito dell&rsquo;evento calamitoso del, 7 agosto 2019, si invita chiunque abbia subito danni alla propria abitazione, ai propri beni mobili oppure alla propria attivit&agrave; a recarsi presso il Comune per ritirare e compilare il modello regionale per il risarcimento dei danni avendo cura di specificare i danni subiti, con un&rsquo;eventuale prima stima dei danni subiti, ed i propri dati identificativi (nominativo &ndash; indirizzo &ndash; mail &ndash; cellulare &ndash; telefono).</p>  <p><strong>Il modello regionale compilato deve essere consegnato entro e non oltre le ore 12:00 di marted&igrave; 13/08/2019 a mano.</strong></p>  <p>Camisano, 09/08/2019<br />  <br />  &nbsp;<br />  <br />  Il Responsabile dell&rsquo;Area Tecnica<br />  <br />  ( Geom. Devis Lorini )</p>  </div>";"<div align=""center"">  <p>A seguito dell&rsquo;evento calamitoso del, 7 agosto  2019, si invita chiunque abbia subito danni alla propria abitazione, ai  propri beni mobili oppure alla propria attivit&agrave; a recarsi presso il  Comune per ritirare e compilare il modello regionale per il risarcimento  dei danni avendo cura di specificare i danni subiti, con un&rsquo;eventuale  prima stima dei danni subiti, ed i propri dati identificativi  (nominativo &ndash; indirizzo &ndash; mail &ndash; cellulare &ndash; telefono).</p>  <p><strong>Il modello regionale compilato deve essere consegnato entro e non oltre le ore 12:00 di marted&igrave; 13/08/2019 a mano.</strong></p>  <p>Camisano, 09/08/2019<br />  <br />  &nbsp;<br />  <br />  Il Responsabile dell&rsquo;Area Tecnica<br />  <br />  ( Geom. Devis Lorini )</p>  </div>";2019-08-09 00:00:00.000;2025-12-14 23:59:59.000;2019-08-09 12:08:29.000;NULL;2019-08-09 12:08:40.000;661;N;;NULL;NULL;S
2066;32;94;A;Avviso orario estivo Uffici Comunali;"<div align=""center"">&nbsp;</div>  <div align=""center"">SI COMUNICA CHE <u>DAL 29 LUGLIO 2019 AL 31 AGOSTO 2019 </u>GLI UFFICI:</div>  <div align=""center"">Serv.Demografici, Protocollo, Ragioneria, Segreteria<br />  OSSERVERANNO IL SEGUENTE ORARIO DI APERTURA AL PUBBLICO:<br />  <strong>da LUNEDI a VENERDI 10:30-12:30</strong><strong> <br />  SABATO 10:30-11:30</strong></div>  <div align=""center"">  <p>&nbsp;</p>  </div>  <div align=""center"">  <p>&nbsp;</p>  <p align=""left""><a href=""/public/upload/File/Comunicazione variazione orario apertura uffici Agosto (1).pdf""><img src=""http://www.comune.pieranica.cr.it/KlanEditorTestuale/editor/images/smiley/msn/confused_smile.gif"" alt="""" width=""19"" height=""19"" border=""0"" align=""absMiddle"" />Avviso.pdf</a></p>  </div>";"<div align=""center"">SI COMUNICA CHE <u>DAL 29 LUGLIO 2019 AL 31 AGOSTO 2019 </u>GLI UFFICI:</div>  <div align=""center"">Serv.Demografici, Protocollo, Ragioneria, Segreteria<br />  OSSERVERANNO IL SEGUENTE ORARIO DI APERTURA AL PUBBLICO:<br />  <strong>da LUNEDI a VENERDI 10:30-12:30</strong><strong> <br />  SABATO 10:30-11:30</strong></div>  <div align=""center"">  <p>&nbsp;</p>  </div>  <div align=""center"">  <p align=""left""><a href=""/public/upload/File/Comunicazione variazione orario apertura uffici Agosto (1).pdf""><img src=""http://www.comune.pieranica.cr.it/KlanEditorTestuale/editor/images/smiley/msn/confused_smile.gif"" alt="""" width=""19"" height=""19"" border=""0"" align=""absMiddle"" />Avviso.pdf</a></p>  </div>";2019-07-26 00:00:00.000;2019-09-01 23:59:59.000;2019-07-26 14:42:04.000;NULL;NULL;661;N;;NULL;NULL;S
2065;32;94;A;Conciliare vita e lavoro, in Lombardia si fa.;"<div align=""center"">&nbsp;</div>  <div align=""center"">  <p><img src=""/public/upload/Image/0001 (7)(1).jpg"" alt="""" width=""194"" height=""265"" /></p>  <p>Sei un cittadino lavoratore dell&rsquo;Ambito Cremasco?<br />  Richiedi il Voucher di &euro;200 per servizi &laquo;Salva Tempo&raquo;<br />  Clicca sulla valigetta &laquo;Conciliazione Vita-Lavoro&raquo; sul sito dell&rsquo;UdP Blog di Crema<br />  <a href=""https://udpcrema.blogspot.com"" target=""_blank"">https://udpcrema.blogspot.com</a></p>  <p align=""left""><a href=""/public/upload/File/Pubblicizzazione voucher conciliativi - PER TUTTI I CITTADINI.pdf"" target=""_blank""><strong>Scarica: Locandina Evento</strong></a></p>  </div>";"<div align=""center"">&nbsp;</div>  <div align=""center"">  <p><img src=""/public/upload/Image/0001 (7)(1).jpg"" alt="""" width=""194"" height=""265"" /></p>  <p>Sei un cittadino lavoratore dell&rsquo;Ambito Cremasco?<br />  Richiedi il Voucher di &euro;200 per servizi &laquo;Salva Tempo&raquo;<br />  Clicca sulla valigetta &laquo;Conciliazione Vita-Lavoro&raquo; sul sito dell&rsquo;UdP Blog di Crema<br />  <a href=""https://udpcrema.blogspot.com"" target=""_blank"">https://udpcrema.blogspot.com</a></p>  <p align=""left""><a href=""/public/upload/File/Pubblicizzazione voucher conciliativi - PER TUTTI I CITTADINI.pdf"" target=""_blank""><strong>Scarica: Locandina Evento</strong></a></p>  <p align=""left"">&nbsp;</p>  </div>";2019-07-24 00:00:00.000;2025-08-13 23:59:59.000;2019-07-24 15:38:18.000;NULL;2019-07-24 15:39:35.000;661;N;;NULL;NULL;S
2064;32;94;A;Piano annuale offerta servizi abitativi;"<p><br />  <a href=""/public/upload/File/Piano annuale.pdf""><img src=""http://www.comune.camisano.cr.it/KlanEditorTestuale/editor/images/smiley/msn/confused_smile.gif"" alt="""" border=""0"" align=""absMiddle"" /></a> Documentazione</p>  <p>&nbsp;</p>  <p>&nbsp;<img src=""/public/upload/image/Camisano/2019/Offerta abitativa.png"" alt="""" width=""240"" height=""183"" /></p>";"<p><font size=""4""><strong>Piano annuale offerta servizi abitativi</strong></font></p>  <p><a href=""/public/upload/File/Piano annuale.pdf""><img src=""http://www.comune.camisano.cr.it/KlanEditorTestuale/editor/images/smiley/msn/confused_smile.gif"" alt="""" border=""0"" align=""absMiddle"" /></a> Documentazione</p>  <p>&nbsp;</p>  <p>&nbsp;<img src=""/public/upload/image/Camisano/2019/Offerta abitativa.png"" alt="""" width=""240"" height=""183"" /></p>";2019-07-17 00:00:00.000;2023-01-01 23:59:59.000;2019-07-17 16:05:46.000;2019-07-17 00:00:00.000;2019-07-17 16:13:04.000;661;N;;NULL;NULL;S
2063;32;94;A;Esenzioni per reddito: Cosa cambia?;"<p>Hai un esenzione da reddito E-E12-E13-E30-E40? Rinnovala entro il 30 settembre 2019 o prima recati dal tuo medico per la prescrizione.</p>  <p><a href=""/public/upload/File/Locandina esenzioni Def_30_09_2019 (2).pdf"" target=""_blank""><img src=""http://www.comune.camisano.cr.it/KlanEditorTestuale/editor/images/smiley/msn/confused_smile.gif"" alt="""" border=""0"" align=""absMiddle"" />Locandina Esenzioni</a></p>  <p align=""center""><img src=""/public/upload/Image/0001 (5)(1).jpg"" alt="""" width=""200"" height=""283"" /></p>";"<p>Hai un esenzione da reddito E-E12-E13-E30-E40? Rinnovala entro il 30 settembre 2019 o prima recati dal tuo medico per la prescrizione.</p>  <p><a href=""/public/upload/File/Locandina esenzioni Def_30_09_2019 (2).pdf"" target=""_blank""><img src=""http://www.comune.camisano.cr.it/KlanEditorTestuale/editor/images/smiley/msn/confused_smile.gif"" alt="""" border=""0"" align=""absMiddle"" />Locandina Esenzioni</a></p>  <p align=""center""><img src=""/public/upload/Image/0001 (5)(1).jpg"" alt="""" width=""200"" height=""283"" /></p>";2019-07-03 00:00:00.000;2025-09-29 23:59:59.000;2019-07-03 16:01:40.000;NULL;2019-07-03 16:01:50.000;661;N;;NULL;NULL;S
2062;32;94;A;RISULTATI ELEZIONI AMMINISTRATIVE;"<p><img src=""http://www.comune.camisano.cr.it/public/upload/image/Camisano/Generali/elezioneSindaco2014.jpg"" alt="""" width=""139"" height=""249"" /></p>  <p><a href=""public/upload/File/SCRUTINIO COMUNALI - Camisano.pdf""><img src=""http://www.comune.camisano.cr.it/KlanEditorTestuale/editor/images/smiley/msn/confused_smile.gif"" alt="""" /></a><a href=""/public/upload/File/SCRUTINIO COMUNALI.pdf"">Scarica il documento</a></p>  <p>&nbsp;</p>";"<p><img src=""http://www.comune.camisano.cr.it/public/upload/image/Camisano/Generali/elezioneSindaco2014.jpg"" alt="""" width=""139"" height=""249"" /></p>  <p><a href=""public/upload/File/SCRUTINIO COMUNALI - Camisano.pdf""><img src=""http://www.comune.camisano.cr.it/KlanEditorTestuale/editor/images/smiley/msn/confused_smile.gif"" alt="""" /></a><a href=""/public/upload/File/SCRUTINIO COMUNALI.pdf"">Scarica il documento</a></p>  <p>&nbsp;</p>";2019-05-28 00:00:00.000;2023-01-01 23:59:59.000;2019-05-28 10:09:05.000;2019-05-28 00:00:00.000;2019-05-29 11:51:00.000;661;N;;NULL;NULL;S
2060;32;94;A;Risultato scrutinio delle Elezioni Europee;"<p><a href=""/public/upload/File/Risultati Scrutinio EUROPEE.pdf"" target=""_blank""><img src=""http://www.comune.camisano.cr.it/KlanEditorTestuale/editor/images/smiley/msn/confused_smile.gif"" alt="""" border=""0"" align=""absMiddle"" /></a>Risultati Scrutinio Europee</p>  <p><a href=""/public/upload/File/Preferenze EUR.zip"" target=""_blank""><img src=""http://www.comune.camisano.cr.it/KlanEditorTestuale/editor/images/smiley/msn/teeth_smile.gif"" alt="""" border=""0"" align=""absMiddle"" /></a>Preferenze EUR</p>";"<p><a href=""/public/upload/File/Risultati Scrutinio EUROPEE.pdf"" target=""_blank""><img src=""http://www.comune.camisano.cr.it/KlanEditorTestuale/editor/images/smiley/msn/confused_smile.gif"" alt="""" border=""0"" align=""absMiddle"" /></a>Risultati Scrutinio Europee</p>  <p><a href=""/public/upload/File/Preferenze EUR.zip"" target=""_blank""><img src=""http://www.comune.camisano.cr.it/KlanEditorTestuale/editor/images/smiley/msn/teeth_smile.gif"" alt="""" border=""0"" align=""absMiddle"" /></a>Preferenze EUR</p>";2019-05-27 00:00:00.000;2025-07-14 23:59:59.000;2019-05-27 14:00:54.000;NULL;NULL;661;N;;NULL;NULL;S
2059;32;94;A;DOTE SCUOLA 2019 - 2020;"<p>&nbsp;</p>  <ul>      <li><a href=""/public/upload/File/DOTE SCUOLA - locandina (1).pdf"" target=""_blank""><img src=""http://www.comune.camisano.cr.it/KlanEditorTestuale/editor/images/smiley/msn/confused_smile.gif"" alt="""" border=""0"" align=""absMiddle"" /></a><span class=""file"">Dote scuola - Locandina</span></li>      <li><a href=""/public/upload/File/DOTE SCUOLA - locandina supporto (1) (1).pdf"" target=""_blank""><img src=""http://www.comune.camisano.cr.it/KlanEditorTestuale/editor/images/smiley/msn/confused_smile.gif"" alt="""" border=""0"" align=""absMiddle"" /></a><span class=""file""> Dote scuola - Locandina supporto</span></li>  </ul>";"<p>&nbsp;</p>  <ul>      <li><a href=""/public/upload/File/DOTE SCUOLA - locandina (1).pdf"" target=""_blank""><img src=""http://www.comune.camisano.cr.it/KlanEditorTestuale/editor/images/smiley/msn/confused_smile.gif"" alt="""" border=""0"" align=""absMiddle"" /></a><span class=""file"">Dote scuola - Locandina</span></li>      <li><a href=""/public/upload/File/DOTE SCUOLA - locandina supporto (1) (1).pdf"" target=""_blank""><img src=""http://www.comune.camisano.cr.it/KlanEditorTestuale/editor/images/smiley/msn/confused_smile.gif"" alt="""" border=""0"" align=""absMiddle"" /></a><span class=""file""> Dote scuola - Locandina supporto</span></li>  </ul>";2019-04-17 00:00:00.000;2025-08-11 23:59:59.000;2019-04-17 17:29:32.000;NULL;2019-04-17 17:30:02.000;661;N;;NULL;NULL;S
2057;32;94;A;Avviso pubblico FNA;"<p>Avviso pubblico per l'assegnazione del FONDO PER LA NON AUTOSUFFICENZA  2018 a persone con disabilit&agrave; grave e anziani non autosufficienti  residenti nei comuni dell'Ambito Distrettuale Cremasco in applicazione  della D.G.R.N. 1253/2018 (Misura B2)</p>  <ul>      <li><a href=""/public/upload/File/Avviso Pubblico FNA prog. 2019 B2 (1).pdf"" target=""_blank""><img src=""http://www.comune.camisano.cr.it/KlanEditorTestuale/editor/images/smiley/msn/confused_smile.gif"" alt="""" border=""0"" align=""absMiddle"" /></a>Avviso pubblico FNA</li>  </ul>";"<p>Avviso pubblico per l'assegnazione del FONDO PER LA NON AUTOSUFFICENZA  2018 a persone con disabilit&agrave; grave e anziani non autosufficienti  residenti nei comuni dell'Ambito Distrettuale Cremasco in applicazione  della D.G.R.N. 1253/2018 (Misura B2)</p>  <ul>      <li><a href=""/public/upload/File/Avviso Pubblico FNA prog. 2019 B2 (1).pdf"" target=""_blank""><img src=""http://www.comune.camisano.cr.it/KlanEditorTestuale/editor/images/smiley/msn/confused_smile.gif"" alt="""" border=""0"" align=""absMiddle"" /></a>Avviso pubblico FNA</li>  </ul>";2019-04-10 00:00:00.000;2023-04-09 23:59:59.000;2019-04-10 15:25:02.000;NULL;NULL;661;N;;NULL;NULL;S
2056;32;94;A;PGT Comune di Camisano;"<p align=""left""><img src=""http://www.comune.castelleone.cr.it/public/upload/image/banner/2014/pgt20.jpg"" alt="""" /></p>  <p>&nbsp;</p>  <p align=""center"">&nbsp;</p>  <ul>      <li><a href=""/public/upload/file/pgt2019/APPROVATO consegnato 19.4.14.zip""><img src=""http://www.comune.fiesco.cr.it/KlanEditorTestuale/editor/images/smiley/msn/teeth_smile.gif"" alt="""" border=""0"" align=""absMiddle"" />PGT approvato</a></li>      <li><a href=""/public/upload/file/pgt2019/SUAP VARIANTE PGT.zip""><img src=""http://www.comune.fiesco.cr.it/KlanEditorTestuale/editor/images/smiley/msn/teeth_smile.gif"" alt="""" border=""0"" align=""absMiddle"" />Prima variante SUAP PGT</a></li>  </ul>";"<p align=""left""><img src=""http://www.comune.castelleone.cr.it/public/upload/image/banner/2014/pgt20.jpg"" alt="""" /></p>  <p>&nbsp;</p>  <ul>      <li><a href=""/public/upload/file/pgt2019/APPROVATO consegnato 19.4.14.zip""><img src=""http://www.comune.fiesco.cr.it/KlanEditorTestuale/editor/images/smiley/msn/teeth_smile.gif"" alt="""" border=""0"" align=""absMiddle"" />PGT approvato</a></li>      <li><a href=""/public/upload/file/pgt2019/SUAP VARIANTE PGT.zip""><img src=""http://www.comune.fiesco.cr.it/KlanEditorTestuale/editor/images/smiley/msn/teeth_smile.gif"" alt="""" border=""0"" align=""absMiddle"" />Prima variante SUAP PGT</a></li>  </ul>";2019-03-26 00:00:00.000;2025-12-15 23:59:59.000;2019-03-26 14:30:20.000;1899-12-30 00:00:00.000;2019-03-27 12:21:46.000;661;N;;NULL;NULL;S
